{
  "id": "nt.congruences-modular-arithmetic",
  "entity_type": "topic",
  "schema_version": "1.0.0",
  "status": "published",
  "subject_id": "number-theory",
  "name": "Congruences and Modular Arithmetic",
  "slug": "congruences-modular-arithmetic",
  "level": "core",
  "display_order": 2,
  "summary": {
    "source_format": "markdown",
    "plain_text": "Train the modular toolkit: congruences, inverses, residue reduction, and short exponent cycles.",
    "markdown": "Train the modular toolkit: congruences, inverses, residue reduction, and short exponent cycles."
  },
  "learning_objectives": [
    "Translate divisibility statements into congruences cleanly.",
    "Reduce large expressions modulo n without losing valid operations.",
    "Use short periodicity arguments to control large exponents."
  ],
  "tracking_profile": {
    "is_trackable": true,
    "mastery_weight": 0.95,
    "review_priority": "high",
    "completion_criteria": ["understand", "apply", "solve", "review"],
    "estimated_effort_minutes": 45
  },
  "prerequisite_topic_ids": ["nt.divisibility-gcd-prime-factorization"],
  "related_topic_ids": ["nt.diophantine-equations"],
  "definition_ids": ["def.nt.congruence-modulo-n"],
  "theorem_ids": ["thm.nt.fermat-little-theorem"],
  "technique_ids": ["tech.nt.reduce-modulo-structure"],
  "example_ids": ["ex.nt.modular-inverse-check"],
  "problem_ids": ["prob.nt.remainder-7-power-100-mod-13"],
  "audit": {
    "created_at": "2026-03-09T08:10:00Z",
    "updated_at": "2026-03-09T08:10:00Z",
    "created_by": "seed.bot",
    "updated_by": "seed.bot"
  }
}
